{
  "descriptorVersion": "0.15",
  "id": "org.example.dsh-webui",
  "apiVersions": { "host": ["v1alpha1"] },
  "execution": {
    "environment": "node",
    "trustMode": "trusted-in-process"
  },
  "capabilities": [
    { "apiVersion": "commands.dsh/v1alpha1", "kind": "Command" },
    { "apiVersion": "storage.dsh/v1alpha1", "kind": "LocalStorage" },
    { "apiVersion": "messages.dsh/v1alpha1", "kind": "MessageObserver" }
  ],
  "platforms": ["darwin-arm64", "win32-x64", "linux-x64"]
}
